occurred_at_iso,type,severity,title,description,lat,lng,source_name,source_url
2026-07-15T12:58:08.000Z,strike,high,US resumes daylight strikes on Iran as tensions escalate over Hormuz,US resumes daylight strikes on Iran as tensions escalate over Hormuz Euronews,,,Euronews,https://news.google.com/rss/articles/CBMitAFBVV95cUxOckNpNXBmbXI1dTh2bUc0S0NHbURrdG5YSkFEN3RXbjNBMjRBYXpUc3pNVXpOVkRaZ2t5UFpXQWRiOXFmUWtZRDVnbnQ3TVlMZ2xuaXk0ak9JOEdzSTlxMnp2SkxtMFNQcnVqbnFYcm43MkNjSmowLUhVaEJtQ0NLUFNrUTdDRlRQdFd5cjY4LURIVWJKc3ozWDJXNDFmYWpTU3FDci1oNXlYeVI3UGFvak9YbTQ?oc=5
2026-07-15T13:00:00.000Z,strike,high,US launches new strikes on Iran,US launches new strikes on Iran Politico,,,Politico,https://news.google.com/rss/articles/CBMikgFBVV95cUxQUE81cDRoSG5wY3ItMDR1Z0RFQk1xWVg1UGJZcHhZQmMyTkM2RzVVbS1wdWRiTzJDVVA1Y2lNU05YZUV2Tk1RZlE1RkpKRVR5Vko2MVM0ZGxqYWpORThXZzh4andRT2U0NVEydzRUSnczVXQ0VE9LdVgtand3bHA3d1NQTmpmOWJhMkhxN0tOcnRsQQ?oc=5
2026-07-15T13:14:16.000Z,negotiation,low,VLGC spot rates surge as charterers pull out of Strait of Hormuz deals,VLGC spot rates surge as charterers pull out of Strait of Hormuz deals TradeWinds News,,,TradeWinds News,https://news.google.com/rss/articles/CBMiuAFBVV95cUxNXzk2MHNUVlNxanM1QzkxZ0ZKeGxFTWh6Wk5Dc091SURFNE9vclFTLTc2ZlFQekxjLTNrQTF4dS1XU0hPMDVMQzMtdUFaWGRXX3JPTlBqMEdYdlB1eEV4c1RBNDhscFJQYWpTNTJRQkdpelRQZnZPQ1ZsNzN6dmIzU05HNmVQeW42YUl2ME5GY0hJb3BDV0V3djNPSDFncDR6SmFmSjdPdmRUTG1xVVBNaUwyZzczdS1T?oc=5
2026-07-15T13:43:17.000Z,strike,high,U.S. launches daytime strikes on Iran to assert control of Strait of Hormuz,U.S. launches daytime strikes on Iran to assert control of Strait of Hormuz CBC,,,CBC,https://news.google.com/rss/articles/CBMiekFVX3lxTFBJcENqQlAwenNFQkJPa01PaEtWT3h1YW5uLTBaUlBKczFScGNGQ1NYdkpNMlkzNlBtSTB1TXdLdWRRa0J5alVOSk1UTW5ObXhWUmlEUTh1UUZpREI2RG5TV1ZlSS1mcTBaMmN1VXAwZWRCTUJOeXJwV3NR?oc=5
2026-07-15T13:44:56.000Z,strike,high,Iran Threatens Wider Energy Chokepoints After Fresh U.S. Strikes,"By Enas Alashray and Tala Ramadan CAIRO/DUBAI, July 15 (Reuters)&#160;&#8211;&#160;The U.S.&#160;conducted&#160;a new wave of strikes against Iran's&#160;coastal defense systems and cruise missile storage and launch sites&#160;on Wednesday after reimposing a...",,,gCaptain,https://gcaptain.com/iran-threatens-wider-energy-chokepoints-after-fresh-u-s-strikes/
2026-07-15T13:54:00.000Z,strike,high,US reimposes blockade and steps up strikes as Iran threatens to halt Mideast energy exports,US reimposes blockade and steps up strikes as Iran threatens to halt Mideast energy exports AP News,,,AP News,https://news.google.com/rss/articles/CBMinwFBVV95cUxOc0ZjN3ZmUVdvbVVLMXFrejJubVRQczZPdVF0QkVwQ3B4SkdNWERtQU5Na0NFWGdrZ0pjU0w1MC05SjhpOHRRVDRZY2lDQkFnRERXWGR6QmlIcV9LaDBQcFdhTThxejdyUDFVbDNBZVlfR0I1Vmg1U19HWERQbnBqUFJJSmpoM2w5VDNacHA4RWZSalpUQ0xwTEpKazJMeGM?oc=5
2026-07-15T14:18:38.000Z,closure,high,Strait of Hormuz-style crisis looms for Russia as Ukraine forces shutdown of a key waterway,Strait of Hormuz-style crisis looms for Russia as Ukraine forces shutdown of a key waterway WAAY 31 News,,,WAAY 31 News,https://news.google.com/rss/articles/CBMi-wFBVV95cUxPOHhlTGtZbjNySzRXTEM4M3oyOUphcUtfcktlUHpjLVZYVmZRZ3lEWmlRRkV6T2JhdEpXS1JtemtuZ28tX1BhT3Zfd1FPMlZxYklFYk1rT0N5d2sxS29mc3NucUVlVTNtU2FTUFpxVTN0WlFBb1ZadlEySTdfQ3ZQUTNsRExRVFNPczZkWThtVTU4dUlKa2NnTDRWMHZEUWtteGh2SVI2RXdFNHBUa3ZJNExkblNTWEdZWThKYnNqTnBIMTBQb1R2RWdKanRRV3R5ak9GVi1NMEVBTk9zSG1Vb1BaX1h0WjlwRlBBdVJnT3RHM1llLXZxZlAzYw?oc=5
2026-07-15T14:35:16.000Z,strike,high,Attack on Dena destroyer exposes enemy fear of Iran’s naval power: Senior commander,"Tehran, IRNA – The Deputy Commander of the Islamic Republic of Iran’s Navy, Rear Admiral Faramarz Bemani, says the attack on the Dena destroyer exposed the enemy’s fear of Iran’s growing naval capabilities and international standing.",,,IRNA · Tehran state media,https://en.irna.ir/news/86210301/Attack-on-Dena-destroyer-exposes-enemy-fear-of-Iran-s-naval-power
