occurred_at_iso,type,severity,title,description,lat,lng,source_name,source_url
2026-02-28T16:00:00.000Z,closure,high,Iran declares Strait of Hormuz closed to commercial shipping,"On February 28, 2026, Iran's parliament voted to authorize the IRGC to close the Strait of Hormuz to commercial shipping, beginning the dual blockade phase that continues to define the crisis.",26.566,56.25,Wikipedia · 2026 Strait of Hormuz crisis,https://en.wikipedia.org/wiki/2026_Strait_of_Hormuz_crisis
2026-04-17T12:00:00.000Z,negotiation,,"Iran declares Strait of Hormuz ""completely open"" — US blockade remains in force","Iranian Foreign Minister Abbas Araghchi announced on social media that passage for all commercial vessels through the Strait of Hormuz was declared completely open. Parliamentary Speaker Mohammad Bagher Ghalibaf contradicted the statement the same day: ""With the continuation of the blockade, the Strait of Hormuz will not remain open."" Only a handful of vessels transited the strait in the days that followed.",,,Al Jazeera,https://www.aljazeera.com/news/2026/4/17/iran-foreign-minister-says-strait-of-hormuz-completely-open
2026-04-25T00:00:00.000Z,closure,medium,Statista: ship traffic in the Strait of Hormuz has virtually stopped,"Statista's industry chart documents the near-complete halt of commercial transit in late February following the IRGC closure declaration, with only a handful of vessels making the passage daily through March.",,,Statista,https://www.statista.com/chart/35984/ship-traffic-in-the-strait-of-hormuz/
2026-04-27T00:00:00.000Z,closure,medium,CSIS: the strait of Hormuz crisis in eight charts,"Center for Strategic and International Studies published an updated analytical brief breaking down transit volume collapse, freight-rate spikes, war-risk premium escalation, and the limited capacity of bypass pipelines.",,,CSIS,https://www.csis.org/analysis/strait-hormuz-8-charts
2026-04-28T00:00:00.000Z,closure,medium,NBC tracker: vessel calls at Gulf ports near multi-year lows,"NBC News data graphics team's ongoing tracker of port calls at Jebel Ali, Bandar Abbas, and Fujairah shows arrivals running far below 2024–2025 baselines through April, with tanker calls hardest hit.",25.5,55.5,NBC News,https://www.nbcnews.com/data-graphics/strait-of-hormuz-ports-traffic-trump-us-iran-war-rcna331507
2026-04-29T00:00:00.000Z,negotiation,low,Analysis: when will Hormuz be safe for commercial shipping again?,"Maritime risk analysts surveyed by Al Jazeera estimate full normalization is unlikely before late summer, with insurance markets pricing a step-down only after a verifiable de-escalation by both sides.",,,Al Jazeera,https://www.aljazeera.com/features/2026/4/28/when-will-strait-of-hormuz-be-safe-for-commercial-shipping-again
2026-04-29T22:00:00.000Z,closure,high,CNN: Hormuz traffic shrunk to a trickle through April,Visual analysis combining AIS replay and satellite imagery shows daily transit volume through the Strait collapsed from a peacetime baseline near 60 vessels per day to single digits at the height of the closure.,26.566,56.25,CNN,https://www.cnn.com/2026/04/29/world/iran-war-gulf-hormuz-shipping-maps-intl-vis
2026-04-30T00:00:00.000Z,ship_incident,high,Iran seizes ships after Trump ceasefire extension,"IRGC naval forces boarded two commercial vessels in the eastern Gulf in the days after the Trump administration extended the ceasefire framework, signaling the truce remains brittle along the maritime axis.",25.5,56.5,CNBC,https://www.cnbc.com/2026/04/29/strait-remains-basically-closed-as-iran-seizes-ships-after-trump-ceasefire-extension.html
2026-05-02T00:00:00.000Z,closure,high,Trump launches Operation Project Freedom convoy escort,"The administration formally announced Operation Project Freedom, a multilateral convoy escort mission tasked with restoring commercial transit through the Strait of Hormuz under US, UK, and French naval cover.",26.566,56.25,Wikipedia · 2026 Strait of Hormuz crisis,https://en.wikipedia.org/wiki/2026_Strait_of_Hormuz_crisis
2026-05-03T00:00:00.000Z,negotiation,medium,Oman hosts indirect US–Iran talks on maritime de-escalation,"Omani mediators are facilitating a quiet round of indirect talks between US and Iranian delegations focused on the maritime track — naval interdictions, IRGC small-boat behavior, and the future of the convoy regime — with no public framework yet.",23.6,58.5,Al Jazeera,https://www.aljazeera.com/features/2026/4/28/when-will-strait-of-hormuz-be-safe-for-commercial-shipping-again
2026-05-03T20:00:00.000Z,strike,high,US destroys six small Iranian boats near Hormuz,"US Navy assets destroyed six small fast-attack craft operated by the IRGC after the boats approached a commercial convoy in the eastern approach to the Strait, CENTCOM said.",26.566,56.65,Bloomberg,https://www.bloomberg.com/news/articles/2026-05-04/us-has-opened-a-passage-through-hormuz-central-command-says
2026-05-04T00:00:00.000Z,negotiation,high,Iran offers to reopen Strait of Hormuz if US lifts blockade,"Iranian foreign ministry says Tehran is prepared to allow commercial transit to resume in exchange for a phased lifting of US Navy interdiction operations, conditioning any deal on a parallel sanctions step.",26.5,53.6,ms.now,https://ms.now/iran-offers-to-reopen-strait-of-hormuz-if-us-lifts-blockade
2026-05-04T06:00:00.000Z,negotiation,low,Prediction markets price normalization no earlier than September,"Kalshi traders are pricing roughly 70% probability that Strait of Hormuz commercial traffic does not return to peacetime baseline before September 1, with the implied reopening date drifting later as escalation continues.",,,CNBC,https://www.cnbc.com/2026/05/04/strait-of-hormuz-traffic-disrupted-until-september-kalshi-traders-say.html
2026-05-04T14:00:00.000Z,strike,medium,CENTCOM denies Iran claim of missile strike on US warship,"Central Command rejected Iran's assertion that an IRGC missile struck a US destroyer operating in the northern Arabian Sea, calling the claim ""categorically false.""",24.8,58.2,CNBC,https://www.cnbc.com/2026/05/04/strait-of-hormuz-traffic-disrupted-until-september-kalshi-traders-say.html
2026-05-04T18:00:00.000Z,closure,high,"US opens passage through Strait of Hormuz, CENTCOM says","United States Central Command says it has opened a transit corridor through the Strait of Hormuz under the new convoy regime, allowing a small group of commercial vessels to move under naval escort.",26.566,56.25,Bloomberg,https://www.bloomberg.com/news/articles/2026-05-04/us-has-opened-a-passage-through-hormuz-central-command-says
2026-05-16T10:00:00.000Z,negotiation,,Iran to unveil mechanism allowing Hormuz transit only for parties cooperating with Iranian leadership,"Ebrahim Azizi, head of Iran's parliamentary national security committee, announced that Tehran will soon unveil a managed-traffic mechanism along designated routes. Eligibility is limited to commercial vessels and parties cooperating with Iran's leadership; operators of the US-backed Project Freedom are explicitly excluded. Specialized services will carry fees.",,,Jerusalem Post,https://www.jpost.com/middle-east/iran-news/article-896365
2026-06-17T20:00:00.000Z,negotiation,,Islamabad Memorandum signed: US and Iran agree 60-day toll-free Hormuz reopening,"Pakistan-brokered 14-point framework signed remotely by Trump and Pezeshkian. It reopens the Strait of Hormuz toll-free for 60 days, ends the US naval blockade of Iran, and extends the ceasefire for 60 days pending nuclear talks.",,,Al Jazeera,https://www.aljazeera.com/news/2026/6/17/iran-confirms-that-mou-has-been-signed-electronically-by-both-sides
2026-06-23T00:01:00.000Z,ship_incident,,Tanker Owners Are Having the Best Week of the Hormuz Crisis,Source: oilprice.com,,,oilprice.com,https://oilprice.com/Latest-Energy-News/World-News/Tanker-Owners-Are-Having-the-Best-Week-of-the-Hormuz-Crisis.html
2026-06-23T00:11:00.000Z,ship_incident,,"Post US - Iran MoU , 11 India - bound ships cross Strait of Hormuz : MEA",Source: tribuneindia.com,,,tribuneindia.com,https://www.tribuneindia.com/news/top-headlines/post-us-iran-mou-11-india-bound-ships-cross-strait-of-hormuz-mea/
2026-06-23T00:43:00.000Z,ship_incident,,Strait of Hormuz future unsettled even as more ships venture through,Source: courant.com,,,courant.com,https://www.courant.com/2026/06/23/strait-of-hormuz-future-unsettled/
2026-06-23T00:50:00.000Z,negotiation,,Who Will Control Navigation In The Strait Of Hormuz ? Oman And Iran Begin Talks,Source: oneindia.com,,,oneindia.com,https://www.oneindia.com/international/who-will-control-navigation-in-the-strait-of-hormuz-oman-and-iran-begin-talks-8127421.html
2026-06-23T00:51:00.000Z,ship_incident,,11 India - bound ships transited Hormuz after US - Iran peace MoU,Source: siasat.com,,,siasat.com,https://www.siasat.com/11-india-bound-ships-transited-hormuz-after-us-iran-peace-mou-3495005/
2026-06-23T00:51:00.000Z,ship_incident,,"11 India - bound vessels carrying oil , LPG successfully cross Strait Of Hormuz after Iran - US deal , says Govt",Source: livemint.com,,,livemint.com,https://www.livemint.com/news/india/11-india-bound-vessels-carrying-oil-lpg-successfully-cross-strait-of-hormuz-after-iran-us-deal-says-govt-11782222099375.html
2026-06-23T00:51:00.000Z,ship_incident,,Tankers Emerge from Dark Mode amid Tentative Hormuz Reopening,Source: oilprice.com,,,oilprice.com,https://oilprice.com/Latest-Energy-News/World-News/Tankers-Emerge-from-Dark-Mode-amid-Tentative-Hormuz-ReopeningTankers-Emerge-from.html
2026-06-23T01:04:00.000Z,ship_incident,,"Post Iran - US MoU , 11 India - bound ships cross Strait of Hormuz ; normalcy gradually returns",Source: tribuneindia.com,,,tribuneindia.com,https://www.tribuneindia.com/news/india/post-iran-us-mou-11-india-bound-ships-cross-strait-of-hormuz-normalcy-gradually-returns/
2026-06-23T01:14:00.000Z,ship_incident,,Hormuz Traffic Picks Up as More Tankers Broadcast Crossings,Source: gcaptain.com,,,gcaptain.com,https://gcaptain.com/hormuz-traffic-picks-up-as-more-tankers-broadcast-crossings/
2026-06-23T01:14:00.000Z,ship_incident,,"11 India - bound ships carrying oil , fertilisers transited Hormuz since June 17 : MEA",Source: thehindubusinessline.com,,,thehindubusinessline.com,https://www.thehindubusinessline.com/economy/11-india-bound-ships-carrying-oil-fertilisers-transited-hormuz-since-june-17-mea/article71138347.ece
2026-06-23T01:24:00.000Z,ship_incident,,The Strait of Hormuz future is unsettled even as more ships venture through,Source: columbian.com,,,columbian.com,https://www.columbian.com/news/2026/jun/23/the-strait-of-hormuzs-future-is-unsettled-even-as-more-ships-venture-through/
2026-06-23T07:55:32.000Z,negotiation,low,Oman reports constructive talks with Iran on Hormuz Strait,"TEHRAN, Jun. 23 (MNA) – Oman and Iran held constructive talks on the Strait of Hormuz in Muscat, with both sides stressing their commitment to international law and safe passage of commercial ships through the strategic waterway.",,,Mehr News · Tehran state media,https://en.mehrnews.com/news/245555/Oman-reports-constructive-talks-with-Iran-on-Hormuz-Strait
2026-06-23T08:00:20.000Z,negotiation,low,Serbian pres. welcomes Iran-US peace deal aimed at ending war,"TEHRAN, Jun. 23 (MNA) – President of Serbia Aleksandar Vucic has welcomed the recent memorandum of understanding (MoU) reached between Iran and the United States with the aim of ending the war imposed against Iran.",,,Mehr News · Tehran state media,https://en.mehrnews.com/news/245554/Serbian-pres-welcomes-Iran-US-peace-deal-aimed-at-ending-war
2026-06-23T15:00:59.000Z,ship_incident,medium,Who Will Govern Hormuz? Iran and Oman Begin Talks on Future Navigation and Maritime Services,"Iran and Oman have begun formal talks on the future administration of navigation in the Strait of Hormuz, including maritime services and associated costs, adding new urgency to questions raised...",,,gCaptain,https://gcaptain.com/who-will-govern-hormuz-iran-and-oman-begin-talks-on-future-navigation-and-maritime-services/
2026-06-23T16:47:46.000Z,negotiation,low,Rubio Faces Task of Easing Gulf Allies' Fears Over U.S. Iran Deal,U.S. Secretary of State Marco Rubio faces a delicate mission this week pitching Washington's Iran peace deal to Gulf Arab leaders who fear excessive concessions will strengthen Tehran and reshape the region's security balance and oil flows.,,,gCaptain,https://gcaptain.com/rubio-faces-tough-task-of-selling-iran-reset-to-wary-gulf-allies/
2026-06-23T21:02:50.000Z,ship_incident,medium,First Ships Return to Hormuz's Central Corridor Since War Began,"By Lori Ann LaRocco &#8211; There are signs of a slow return to normalcy in the Strait of Hormuz, but it will take time for tanker owners and operators to...",,,gCaptain,https://gcaptain.com/first-ships-return-to-hormuzs-central-corridor-since-war-began/
2026-06-24T00:14:00.000Z,ship_incident,,Shipping stalls in Strait of Hormuz after Iran declares key waterway closed again,Source: hellenicshippingnews.com,,,hellenicshippingnews.com,https://www.hellenicshippingnews.com/shipping-stalls-in-strait-of-hormuz-after-iran-declares-key-waterway-closed-again/
2026-06-24T00:20:00.000Z,ship_incident,,Ship Trackers See More Vessels Passing Through Strait of Hormuz,Source: breitbart.com,,,breitbart.com,https://www.breitbart.com/middle-east/2026/06/23/ship-trackers-see-more-vessels-passing-through-strait-hormuz/
2026-06-24T00:31:00.000Z,ship_incident,,Tanker Owners Having The Best Week Of The Hormuz Crisis As VLCC Rates Soar,Source: zerohedge.com,,,zerohedge.com,https://www.zerohedge.com/energy/tanker-owners-having-best-week-hormuz-crisis-vlcc-rates-soar
2026-06-24T00:43:00.000Z,ship_incident,,Oman unveils temporary Hormuz Strait shipping lane,Source: israelnationalnews.com,,,israelnationalnews.com,https://www.israelnationalnews.com/news/429100
2026-06-24T00:54:00.000Z,ship_incident,,Crude oil futures fall nearly 1 % as Hormuz tanker traffic improves,Source: thehindubusinessline.com,,,thehindubusinessline.com,https://www.thehindubusinessline.com/markets/commodities/crude-oil-futures-fall-nearly-1-as-hormuz-tanker-traffic-improves/article71140432.ece
2026-06-24T01:04:00.000Z,ship_incident,,Shipping Tribune,Source: shippingtribune.com,,,shippingtribune.com,https://www.shippingtribune.com/news/shipping/Crude+oil+futures+fall+as+Hormuz+tanker+traffic+improves
2026-06-24T01:04:00.000Z,ship_incident,,"4 More S . Korean - Operated Vessels Clear Strait of Hormuz , but 18 Remain",Source: world.kbs.co.kr,,,world.kbs.co.kr,https://world.kbs.co.kr/service/news_view.htm?lang=e&Seq_Code=202406
2026-06-24T01:13:00.000Z,closure,,"Hormuz Blockade : कच्चा तेल , गैस और खाद लेकर होर्मुज से भारत के लिए निकले 11 टैंकर , टली बड़ी आफत ; 10 अभी भी फंसे",Source: navbharattimes.indiatimes.com,,,navbharattimes.indiatimes.com,https://navbharattimes.indiatimes.com/business/business-news/11-india-bound-ships-transited-hormuz-strait-with-crude-lpg-and-fertiliser/articleshow/131957898.cms
2026-06-24T01:30:00.000Z,ship_incident,,Hooked on Hormuz : How barnacles grounded hundreds of oil tankers,Source: indianexpress.com,,,indianexpress.com,https://indianexpress.com/article/world/strait-hormuz-reopening-biofouling-oil-tankers-stuck-iran-ceasefire-10754641/
